Stkcd,Stknme,Listdt,Cuntrycd,Conme,Conme_en,Indcd,Indnme,Nindcd,Nindnme,Nnindcd,Nnindnme,Estbdt,PROVINCE,PROVINCECODE,CITY,CITYCODE,OWNERSHIPTYPE,OWNERSHIPTYPECODE,Favaldt,Curtrd,Ipoprm,Ipoprc,Ipocur,Nshripo,Parvcur,Ipodt,Parval,Sctcd,Statco,Crcd,Statdt,Commnt,Markettype
962,东方钽业,2000-01-20,10,宁夏东方钽业股份有限公司,"Ningxia Orient Tantalum Industry Co., Ltd.",5,工业,C67,有色金属冶炼及压延加工业,C32,有色金属冶炼及压延加工业,1999-04-30,宁夏回族自治区,640000,石嘴山市,640200,国营或国有控股,P0301,2000-01-20,CNY,8.4000,9.4000,CNY,65000,CNY,1999-11-22,1.000,2,A,,2024-01-15,,4
963,华东医药,2000-01-27,10,华东医药股份有限公司,"Huadong Medicine Co., Ltd.",6,商业,H11,零售业,F52,零售业,1999-03-31,浙江省,330000,杭州市,330100,私营企业,P0306,2000-01-27,CNY,4.7600,5.7600,CNY,50000,CNY,1999-12-22,1.000,2,A,,2024-01-15,,4
965,天保基建,2000-04-06,10,天津天保基建股份有限公司,"Tianjin Tianbao Infrastructure Co., Ltd.",3,房地产,J,房地产业,K70,房地产业,1998-09-30,天津市,120000,天津市,120000,国营或国有控股,P0301,2000-04-06,CNY,3.6000,4.6000,CNY,70000,CNY,2000-03-17,1.000,2,A,,2024-01-15,,4
966,长源电力,2000-03-16,10,国家能源集团长源电力股份有限公司,"CHN Energy Changyuan Electric Power Co., Ltd.",5,工业,D01,电力、蒸汽、热水的生产和供应业,D44,电力、热力生产和供应业,1995-04-07,湖北省,420000,武汉市,420100,国营或国有控股,P0301,2000-03-16,CNY,5.1000,6.1000,CNY,90000,CNY,2000-02-17,1.000,2,A,,2024-01-15,,4
967,盈峰环境,2000-03-30,10,盈峰环境科技集团股份有限公司,"Infore Environment Technology Group Co., Ltd.",2,公用事业,K99,其他社会服务业,N77,生态保护和环境治理业,1993-11-18,浙江省,330000,绍兴市,330600,私营企业,P0306,2000-03-30,CNY,5.6200,6.6200,CNY,45000,CNY,2000-03-10,1.000,2,A,,2024-01-15,,4
968,蓝焰控股,2000-06-22,10,山西蓝焰控股股份有限公司,"Shanxi Blue Flame Holding Company Limited",5,工业,B03,石油和天然气开采业,B07,石油和天然气开采业,1998-12-22,山西省,140000,太原市,140100,国营或国有控股,P0301,2000-06-22,CNY,3.6000,4.6000,CNY,150000,CNY,2000-05-10,1.000,2,A,,2024-01-15,,4
969,安泰科技,2000-05-29,10,安泰科技股份有限公司,"Advanced Technology & Materials Co., Ltd.",5,工业,C69,金属制品业,C33,金属制品业,1998-12-30,北京市,110000,北京市,110000,国营或国有控股,P0301,2000-05-29,CNY,13.9800,14.9800,CNY,60000,CNY,2000-05-12,1.000,2,A,,2024-01-15,,4
970,中科三环,2000-04-20,10,北京中科三环高技术股份有限公司,"Beijing Zhongke Sanhuan High-Tech Co., Ltd.",5,工业,G,信息技术业,C39,计算机、通信和其他电子设备制造业,1999-07-23,北京市,110000,北京市,110000,中外合资,P0303,2000-04-20,CNY,6.5000,7.5000,CNY,35000,CNY,2000-03-31,1.000,2,A,,2024-01-15,,4
971,"ST 高升",2000-04-27,10,高升控股股份有限公司,"Gosun Holding Co., Ltd.",2,公用事业,G87,计算机应用服务业,I65,软件和信息技术服务业,1993-03-26,湖北省,420000,仙桃市,429004,私营企业,P0306,2000-04-27,CNY,3.4200,4.4200,CNY,55000,CNY,2000-04-07,1.000,2,A,,2024-01-15,,4
972,中基健康,2000-09-26,10,中基健康产业股份有限公司,"Chalkis Health Industry Co., Ltd.",5,工业,C01,食品加工业,C13,农副食品加工业,1994-06-30,新疆维吾尔自治区,650000,五家渠市,659004,国营或国有控股,P0301,2000-09-26,CNY,4.0000,5.0000,CNY,45000,CNY,2000-04-14,1.000,2,A,,2024-01-15,,4
973,佛塑科技,2000-05-25,10,佛山佛塑科技集团股份有限公司,"FSPG Hi-Tech Co., Ltd.",5,工业,C4,石油、化学、塑胶、塑料,C29,橡胶和塑料制品业,1988-06-01,广东省,440000,佛山市,440600,国营或国有控股,P0301,2000-05-25,CNY,5.2800,6.2800,CNY,95000,CNY,2000-04-20,1.000,2,A,,2024-01-15,,4
975,银泰黄金,2000-06-08,10,银泰黄金股份有限公司,"Yintai Gold Co., Ltd.",5,工业,B07,有色金属矿采选业,B09,有色金属矿采选业,1999-06-18,内蒙古自治区,150000,锡林郭勒盟,152500,私营企业,P0306,2000-06-08,CNY,5.6000,6.6000,CNY,80000,CNY,2000-04-24,1.000,2,A,,2024-01-15,,4
976,"ST 华铁",2000-06-01,10,广东华铁通达高铁装备股份有限公司,"Guangdong Huatie Tongda High-speed Railway Equipment Corporation",5,工业,C75,交通运输设备制造业,C37,铁路、船舶、航空航天和其它运输设备制造业,1993-01-18,广东省,440000,开平市,440783,国营或国有控股,P0301,2000-06-01,CNY,7.6800,8.6800,CNY,70000,CNY,2000-05-08,1.000,2,A,,2024-01-15,,4
977,浪潮信息,2000-06-08,10,浪潮电子信息产业股份有限公司,"Inspur Electronic Information Industry Co., Ltd.",5,工业,G,信息技术业,C39,计算机、通信和其他电子设备制造业,1998-10-28,山东省,370000,济南市,370100,国营或国有控股,P0301,2000-06-08,CNY,6.7100,7.7100,CNY,65000,CNY,2000-04-24,1.000,2,A,,2024-01-15,,4
978,桂林旅游,2000-05-18,10,桂林旅游股份有限公司,"Guilin Tourism Corporation Limited",2,公用事业,K01,公共设施服务业,N78,公共设施管理业,1998-04-29,广西壮族自治区,450000,桂林市,450300,国营或国有控股,P0301,2000-05-18,CNY,5.8600,6.8600,CNY,40000,CNY,2000-04-21,1.000,2,A,,2024-01-15,,4
979,中弘退,2000-06-16,10,中弘控股股份有限公司,"Zhonghong Holding Co., Ltd.",3,房地产,J,房地产业,K70,房地产业,1997-08-18,安徽省,340000,宿州市,341300,私营企业,P0306,2000-06-16,CNY,9.0800,10.0800,CNY,40000,CNY,2000-05-12,1.000,2,D,,2018-12-28,,4
980,众泰汽车,2000-06-16,10,众泰汽车股份有限公司,"Zotye Automobile Co., Ltd.",5,工业,C75,交通运输设备制造业,C36,汽车制造业,1998-08-31,浙江省,330000,永康市,330784,私营企业,P0306,2000-06-16,CNY,4.4900,5.4900,CNY,58000,CNY,2000-05-19,1.000,2,A,,2024-01-15,,4
981,山子股份,2000-06-22,10,山子高科技股份有限公司,"Sensteed Hi-tech Group",5,工业,C75,交通运输设备制造业,C36,汽车制造业,1998-08-31,甘肃省,620000,兰州市,620100,国营或国有控股,P0301,2000-06-22,CNY,7.6800,8.6800,CNY,50000,CNY,2000-05-31,1.000,2,A,,2024-01-15,,4
982,中银绒业,2000-07-06,10,宁夏中银绒业股份有限公司,"Ningxia Zhongyin Cashmere Co., Ltd.",5,工业,C11,纺织业,C17,纺织业,1998-09-15,宁夏回族自治区,640000,灵武市,640181,私营企业,P0306,2000-07-06,CNY,7.6000,8.6000,CNY,30000,CNY,2000-06-16,1.000,2,A,,2024-01-15,,4
983,山西焦煤,2000-07-26,10,山西焦煤能源集团股份有限公司,"Shanxi Coking Coal Energy Group Co.,Ltd.",5,工业,B01,煤炭采选业,B06,煤炭开采和洗选业,1999-04-26,山西省,140000,太原市,140100,国营或国有控股,P0301,2000-07-26,CNY,5.4900,6.4900,CNY,288000,CNY,2000-07-06,1.000,2,A,,2024-01-15,,4
985,大庆华科,2000-07-26,10,大庆华科股份有限公司,"Daqing Huake Co., Ltd.",5,工业,C43,化学原料及化学制品制造业,C26,化学原料及化学制品制造业,1998-12-08,黑龙江省,230000,大庆市,230600,国营或国有控股,P0301,2000-07-26,CNY,7.3400,8.3400,CNY,30000,CNY,2000-07-07,1.000,2,A,,2024-01-15,,4
987,越秀资本,2000-07-18,10,广州越秀资本控股集团股份有限公司,"Guangzhou Yuexiu Capital Holdings Group Co., Ltd.",1,金融,I99,其他金融业,J69,其他金融业,1992-12-28,广东省,440000,广州市,440100,国营或国有控股,P0301,2000-07-18,CNY,3.0800,4.0800,CNY,60000,CNY,2000-06-30,1.000,2,A,,2024-01-15,,4
988,华工科技,2000-06-08,10,华工科技产业股份有限公司,"Huagong Tech Company Limited",5,工业,G,信息技术业,C39,计算机、通信和其他电子设备制造业,1999-07-28,湖北省,420000,武汉市,420100,国营或国有控股,P0301,2000-06-08,CNY,12.9800,13.9800,CNY,30000,CNY,2000-05-15,1.000,2,A,,2024-01-15,,4
989,九芝堂,2000-06-28,10,九芝堂股份有限公司,"Jiuzhitang Co., Ltd.",5,工业,C81,医药制造业,C27,医药制造业,1999-05-12,湖南省,430000,长沙市,430100,国营或国有控股,P0301,2000-06-28,CNY,8.0000,9.0000,CNY,40000,CNY,2000-06-09,1.000,2,A,,2024-01-15,,4
990,诚志股份,2000-07-06,10,诚志股份有限公司,"Chengzhi Shareholding Co., Ltd.",5,工业,C43,化学原料及化学制品制造业,C26,化学原料及化学制品制造业,1998-10-09,江西省,360000,南昌市,360100,国营或国有控股,P0301,2000-07-06,CNY,8.9000,9.9000,CNY,48000,CNY,2000-06-19,1.000,2,A,,2024-01-15,,4
993,闽东电力,2000-07-31,10,福建闽东电力股份有限公司,"Fujian Mindong Electric Power Co., Ltd.",5,工业,D01,电力、蒸汽、热水的生产和供应业,D44,电力、热力生产和供应业,1998-12-30,福建省,350000,宁德市,350900,国营或国有控股,P0301,2000-07-31,CNY,10.5000,11.5000,CNY,100000,CNY,2000-07-13,1.000,2,A,,2024-01-15,,4
995,皇台酒业,2000-08-07,10,甘肃皇台酒业股份有限公司,"Gansu Huangtai Wine-Marketing Industry Co., Ltd.",5,工业,C05,饮料制造业,C15,酒、饮料和精制茶制造业,1998-09-29,甘肃省,620000,武威市,620600,私营企业,P0306,2000-08-07,CNY,6.8000,7.8000,CNY,40000,CNY,2000-07-13,1.000,2,A,,2024-01-15,,4
996,"*ST 中期",2000-07-18,10,中国中期投资股份有限公司,"China CIFCO Investment Co., Ltd.",6,商业,H,批发和零售贸易,F51,批发业,1994-08-28,北京市,110000,北京市,110000,私营企业,P0306,2000-07-18,CNY,7.2800,8.2800,CNY,35000,CNY,2000-07-03,1.000,2,A,,2024-01-15,,4
997,新大陆,2000-08-07,10,新大陆数字技术股份有限公司,"Newland Digital Technology Co., Ltd.",2,公用事业,G87,计算机应用服务业,I65,软件和信息技术服务业,1999-06-28,福建省,350000,福州市,350100,私营企业,P0306,2000-08-07,CNY,14.8800,15.8800,CNY,31000,CNY,2000-07-20,1.000,2,A,,2024-01-15,,4
998,隆平高科,2000-12-11,10,袁隆平农业高科技股份有限公司,"Yuan Longping High-Tech Agriculture Co., Ltd.",4,综合,A01,农业,A01,农业,1999-06-30,湖南省,430000,长沙市,430100,国营或国有控股,P0301,2000-12-11,CNY,11.9800,12.9800,CNY,55000,CNY,2000-05-31,1.000,2,A,,2024-01-15,,4
999,华润三九,2000-03-09,10,华润三九医药股份有限公司,"China Resources Sanjiu Medical & Pharmaceutical Co., Ltd.",5,工业,C81,医药制造业,C27,医药制造业,1999-04-21,广东省,440000,深圳市,440300,国营或国有控股,P0301,2000-03-09,CNY,7.4500,8.4500,CNY,200000,CNY,1999-11-11,1.000,2,A,,2024-01-15,,4
1201,东瑞股份,2021-04-28,10,东瑞食品集团股份有限公司,"Dongrui Food Group Co., Ltd.",4,综合,A05,畜牧业,A03,畜牧业,2002-03-27,广东省,440000,河源市,441600,私营企业,P0306,2021-04-28,CNY,62.3800,63.3800,CNY,31670,CNY,2021-04-14,1.000,2,A,,2024-01-15,,4
1202,炬申股份,2021-04-29,10,广东炬申物流股份有限公司,"Guangdong Jushen Logistics Co., Ltd.",2,公用事业,F11,交通运输辅助业,G58,装卸搬运和运输代理业,2011-11-10,广东省,440000,佛山市,440600,私营企业,P0306,2021-04-29,CNY,14.0900,15.0900,CNY,32242,CNY,2021-04-19,1.000,2,A,,2024-01-15,,4
1203,大中矿业,2021-05-10,10,内蒙古大中矿业股份有限公司,"Inner Mongolia Dazhong Mining Co., Ltd.",5,工业,B05,黑色金属矿采选业,B08,黑色金属矿采选业,1999-10-29,内蒙古自治区,150000,巴彦淖尔市,150800,私营企业,P0306,2021-05-10,CNY,7.9800,8.9800,CNY,218940,CNY,2021-04-20,1.000,2,A,,2024-01-15,,4
1205,盛航股份,2021-05-13,10,南京盛航海运股份有限公司,"Nanjing Shenghang Shipping Co., Ltd.",2,公用事业,F07,水上运输业,G55,水上运输业,1994-11-07,江苏省,320000,南京市,320100,私营企业,P0306,2021-05-13,CNY,15.5200,16.5200,CNY,30067,CNY,2021-04-28,1.000,2,A,,2024-01-15,,4
1206,依依股份,2021-05-18,10,天津市依依卫生用品股份有限公司,"Tianjin Yiyi Hygiene Products Co., Ltd.",5,工业,C31,造纸及纸制品业,C22,造纸及纸制品业,1990-05-10,天津市,120000,天津市,120000,私营企业,P0306,2021-05-18,CNY,43.6000,44.6000,CNY,23583,CNY,2021-05-06,1.000,2,A,,2024-01-15,,4
1207,联科科技,2021-06-23,10,山东联科科技股份有限公司,"Shandong Link Science and Technology Co., Ltd.",5,工业,C43,化学原料及化学制品制造业,C26,化学原料及化学制品制造业,2001-04-23,山东省,370000,青州市,370781,私营企业,P0306,2021-06-23,CNY,13.2700,14.2700,CNY,45500,CNY,2021-06-09,1.000,2,A,,2024-01-15,,4
1208,华菱线缆,2021-06-24,10,湖南华菱线缆股份有限公司,"Hunan Valin Wire & Cable Co., Ltd.",5,工业,C76,电器机械及器材制造业,C38,电气机械及器材制造业,2003-07-01,湖南省,430000,湘潭市,430300,私营企业,P0306,2021-06-24,CNY,2.6700,3.6700,CNY,133606,CNY,2021-06-10,1.000,2,A,,2024-01-15,,4
1209,洪兴股份,2021-07-23,10,广东洪兴实业股份有限公司,"Guangdong Hongxing Industrial Co., Ltd.",5,工业,C13,服装及其他纤维制品制造业,C18,纺织服装、服饰业,2004-05-20,广东省,440000,汕头市,440500,私营企业,P0306,2021-07-23,CNY,28.8800,29.8800,CNY,23487,CNY,2021-07-08,1.000,2,A,,2024-01-15,,4
1210,金房能源,2021-07-29,10,金房能源集团股份有限公司,"Kingfore Energy Group Co., Ltd.",5,工业,D01,电力、蒸汽、热水的生产和供应业,D44,电力、热力生产和供应业,1992-11-08,北京市,110000,北京市,110000,私营企业,P0306,2021-07-29,CNY,27.0100,28.0100,CNY,22690,CNY,2021-07-16,1.000,2,A,,2024-01-15,,4
1211,双枪科技,2021-08-05,10,双枪科技股份有限公司,"Suncha Technology Co., Ltd.",5,工业,C21,木材加工及竹、藤、棕、草制品业,C20,木材加工及木、竹、藤、棕、草制品业,2002-09-20,浙江省,330000,杭州市,330100,私营企业,P0306,2021-08-05,CNY,25.4000,26.4000,CNY,18000,CNY,2021-07-26,1.000,2,A,,2024-01-15,,4
1212,中旗新材,2021-08-23,10,广东中旗新材料股份有限公司,"Sinostone (Guangdong) Co., Ltd.",5,工业,C61,非金属矿物制品业,C30,非金属矿物制品业,2007-03-27,广东省,440000,佛山市,440600,私营企业,P0306,2021-08-23,CNY,30.6700,31.6700,CNY,22670,CNY,2021-08-12,1.000,2,A,,2024-01-15,,4
1213,中铁特货,2021-09-08,10,中铁特货物流股份有限公司,"China Railway Special Cargo Logistics Co., Ltd.",2,公用事业,F01,铁路运输业,G53,铁路运输业,2003-11-04,北京市,110000,北京市,110000,私营企业,P0306,2021-09-08,CNY,2.9600,3.9600,CNY,444444,CNY,2021-08-27,1.000,2,A,,2024-01-15,,4
1215,千味央厨,2021-09-06,10,郑州千味央厨食品股份有限公司,"Zhengzhou Qianwei Yangchu Food Co., Ltd.",5,工业,C03,食品制造业,C14,食品制造业,2012-04-25,河南省,410000,郑州市,410100,私营企业,P0306,2021-09-06,CNY,14.7100,15.7100,CNY,21280,CNY,2021-08-26,1.000,2,A,,2024-01-15,,4
1216,华瓷股份,2021-10-19,10,湖南华联瓷业股份有限公司,"Hunan Hualian China Industry Co., Ltd.",5,工业,C61,非金属矿物制品业,C30,非金属矿物制品业,1994-08-01,湖南省,430000,醴陵市,430281,中外合资,P0303,2021-10-19,CNY,8.3700,9.3700,CNY,62967,CNY,2021-10-08,1.000,2,A,,2024-01-15,,4
1217,华尔泰,2021-09-29,10,安徽华尔泰化工股份有限公司,"Anhui Huaertai Chemical Co., Ltd.",5,工业,C43,化学原料及化学制品制造业,C26,化学原料及化学制品制造业,2000-01-05,安徽省,340000,池州市,341700,私营企业,P0306,2021-09-29,CNY,9.4600,10.4600,CNY,82970,CNY,2021-09-16,1.000,2,A,,2024-01-15,,4
1218,丽臣实业,2021-10-15,10,湖南丽臣实业股份有限公司,"Hunan Resun Co., Ltd.",5,工业,C43,化学原料及化学制品制造业,C26,化学原料及化学制品制造业,1997-11-24,湖南省,430000,长沙市,430100,私营企业,P0306,2021-10-15,CNY,44.5100,45.5100,CNY,22500,CNY,2021-09-24,1.000,2,A,,2024-01-15,,4
1219,青岛食品,2021-10-21,10,青岛食品股份有限公司,"Qingdao Foods Co., Ltd.",5,工业,C03,食品制造业,C14,食品制造业,1992-11-21,山东省,370000,青岛市,370200,国营或国有控股,P0301,2021-10-21,CNY,16.2000,17.2000,CNY,22200,CNY,2021-09-30,1.000,2,A,,2024-01-15,,4
1222,源飞宠物,2022-08-18,10,温州源飞宠物玩具制品股份有限公司,"Wenzhou Yuanfei Pet Toy Products Co., Ltd.",5,工业,C37,文教体育用品制造业,C24,文教、工美、体育和娱乐用品制造业,2004-09-27,浙江省,330000,温州市,330300,私营企业,P0306,2022-08-18,CNY,12.7100,13.7100,CNY,34100,CNY,2022-08-03,1.000,2,A,,2024-01-15,,4
1223,欧克科技,2022-12-12,10,欧克科技股份有限公司,"OK Science and Technology Co., Ltd.",5,工业,C73,专用设备制造业,C35,专用设备制造业,2011-08-23,江西省,360000,九江市,360400,私营企业,P0306,2022-12-12,CNY,64.5800,65.5800,CNY,16680,CNY,2022-12-01,1.000,2,A,,2024-01-15,,4
1225,和泰机电,2023-02-22,10,杭州和泰机电股份有限公司,"Hangzhou Hota M&E Industry Co., Ltd.",5,工业,C71,普通机械制造业,C34,通用设备制造业,1995-06-23,浙江省,330000,杭州市,330100,私营企业,P0306,2023-02-22,CNY,45.8100,46.8100,CNY,16167,CNY,2023-02-08,1.000,2,A,,2024-01-15,,4
1226,拓山重工,2022-06-22,10,安徽拓山重工股份有限公司,"Anhui Tuoshan Heavy Industries Co., Ltd.",5,工业,C69,金属制品业,C33,金属制品业,2011-05-23,安徽省,340000,宣城市,341800,私营企业,P0306,2022-06-22,CNY,23.6600,24.6600,CNY,18667,CNY,2022-06-13,1.000,2,A,,2024-01-15,,4
1227,兰州银行,2022-01-17,10,兰州银行股份有限公司,"BANK OF LANZHOU CO., LTD.",1,金融,I01,银行业,J66,货币金融服务,1997-06-26,甘肃省,620000,兰州市,620100,国营或国有控股,P0301,2022-01-17,CNY,2.5700,3.5700,CNY,569570,CNY,2022-01-05,1.000,2,A,,2024-01-15,,4
1228,永泰运,2022-04-29,10,永泰运化工物流股份有限公司,"Yongtaiyun Chemical Logistics Co., Ltd.",2,公用事业,K99,其他社会服务业,L72,商务服务业,2002-12-27,浙江省,330000,宁波市,330200,私营企业,P0306,2022-04-29,CNY,29.4600,30.4600,CNY,25970,CNY,2022-04-20,1.000,2,A,,2024-01-15,,4
1229,魅视科技,2022-08-08,10,广东魅视科技股份有限公司,"Guangdong AVCiT Technology Holding Co., Ltd.",5,工业,G,信息技术业,C39,计算机、通信和其他电子设备制造业,2010-08-04,广东省,440000,广州市,440100,私营企业,P0306,2022-08-08,CNY,20.7100,21.7100,CNY,25000,CNY,2022-07-28,1.000,2,A,,2024-01-15,,4
1230,劲旅环境,2022-07-15,10,劲旅环境科技股份有限公司,"Jinglv Environment Science and Technology Co., Ltd.",2,公用事业,K01,公共设施服务业,N78,公共设施管理业,2002-07-24,安徽省,340000,合肥市,340100,国营或国有控股,P0301,2022-07-15,CNY,33.5100,34.5100,CNY,27848,CNY,2022-07-05,1.000,2,A,,2024-01-15,,4
1231,农心科技,2022-08-19,10,农心作物科技股份有限公司,"NORSYN CROP TECHNOLOGY CO., LTD.",5,工业,C43,化学原料及化学制品制造业,C26,化学原料及化学制品制造业,2006-06-07,陕西省,610000,西安市,610100,私营企业,P0306,2022-08-19,CNY,16.7700,17.7700,CNY,25000,CNY,2022-08-09,1.000,2,A,,2024-01-15,,4
1234,泰慕士,2022-01-11,10,江苏泰慕士针纺科技股份有限公司,"Jiangsu Times Textile Technology Co., Ltd.",5,工业,C13,服装及其他纤维制品制造业,C18,纺织服装、服饰业,1992-08-26,江苏省,320000,如皋市,320682,私营企业,P0306,2022-01-11,CNY,15.5300,16.5300,CNY,26667,CNY,2021-12-29,1.000,2,A,,2024-01-15,,4
1236,弘业期货,2022-08-05,10,弘业期货股份有限公司,"Holly Futures Co., Ltd.",1,金融,I21,证券、期货业,J67,资本市场服务,1995-07-31,江苏省,320000,南京市,320100,国营或国有控股,P0301,2022-08-05,CNY,0.8600,1.8600,CNY,100778,CNY,2022-07-27,1.000,2,A,,2024-01-15,03678,4
1238,浙江正特,2022-09-19,10,浙江正特股份有限公司,"Zhejiang Zhengte Co., Ltd.",5,工业,C25,家具制造业,C21,家具制造业,1996-09-12,浙江省,330000,临海市,331082,私营企业,P0306,2022-09-19,CNY,15.0500,16.0500,CNY,27500,CNY,2022-09-07,1.000,2,A,,2024-01-15,,4
1239,永达股份,2023-12-12,10,湘潭永达机械制造股份有限公司,"Xiangtan Yongda Machinery Manufacturing Co., Ltd.",5,工业,C69,金属制品业,C33,金属制品业,2005-07-04,湖南省,430000,湘潭市,430300,私营企业,P0306,2023-12-12,CNY,11.0500,12.0500,CNY,60000,CNY,2023-11-30,1.000,2,A,,2024-01-15,,4
1255,博菲电气,2022-09-30,10,浙江博菲电气股份有限公司,"Zhejiang Bofay Electric Co., Ltd.",5,工业,C43,化学原料及化学制品制造业,C26,化学原料及化学制品制造业,2007-03-07,浙江省,330000,海宁市,330481,私营企业,P0306,2022-09-30,CNY,18.7700,19.7700,CNY,20000,CNY,2022-09-20,1.000,2,A,,2024-01-15,,4
1256,炜冈科技,2022-12-05,10,浙江炜冈科技股份有限公司,"Zhejiang Weigang Technology Co., Ltd.",5,工业,C73,专用设备制造业,C35,专用设备制造业,2007-04-24,浙江省,330000,温州市,330300,私营企业,P0306,2022-12-05,CNY,12.6400,13.6400,CNY,35654,CNY,2022-11-22,1.000,2,A,,2024-01-15,,4
1258,立新能源,2022-07-27,10,新疆立新能源股份有限公司,"Xinjiang Lixin Energy Co., Ltd.",5,工业,D01,电力、蒸汽、热水的生产和供应业,D44,电力、热力生产和供应业,2013-08-28,新疆维吾尔自治区,650000,乌鲁木齐市,650100,国营或国有控股,P0301,2022-07-27,CNY,2.3800,3.3800,CNY,233333,CNY,2022-07-13,1.000,2,A,,2024-01-15,,4
1259,利仁科技,2022-08-31,10,北京利仁科技股份有限公司,"Beijing Liven Technology Co., Ltd.",5,工业,C76,电器机械及器材制造业,C38,电气机械及器材制造业,1998-10-05,北京市,110000,北京市,110000,私营企业,P0306,2022-08-31,CNY,18.7500,19.7500,CNY,18484,CNY,2022-08-17,1.000,2,A,,2024-01-15,,4
1260,坤泰股份,2023-02-16,10,山东坤泰新材料科技股份有限公司,"Shandong Kuntai New Material Technology Co., Ltd.",5,工业,C75,交通运输设备制造业,C36,汽车制造业,2009-12-16,山东省,370000,烟台市,370600,私营企业,P0306,2023-02-16,CNY,13.2700,14.2700,CNY,28750,CNY,2023-02-07,1.000,2,A,,2024-01-15,,4
1266,宏英智能,2022-02-28,10,上海宏英智能科技股份有限公司,"Shanghai Smart Control Co., Ltd.",5,工业,C78,仪器仪表及文化、办公用机械制造业,C40,仪器仪表制造业,2005-11-01,上海市,310000,上海市,310000,私营企业,P0306,2022-02-28,CNY,37.6100,38.6100,CNY,18360,CNY,2022-02-17,1.000,2,A,,2024-01-15,,4
1267,汇绿生态,2021-11-17,10,汇绿生态科技集团股份有限公司,"Hui Lyu Ecological Technology Groups Co., Ltd.",3,房地产,E01,土木工程建筑业,E48,土木工程建筑业,1990-01-29,湖北省,420000,武汉市,420100,私营企业,P0306,2021-11-17,CNY,2.9100,3.9100,CNY,,CNY,1992-04-01,1.000,2,A,,2024-01-15,,4
1268,联合精密,2022-06-30,10,广东扬山联合精密制造股份有限公司,"Guangdong Yangshan United Precision Manufacturing Co., Ltd.",5,工业,C71,普通机械制造业,C34,通用设备制造业,2003-08-29,广东省,440000,清远市,441800,私营企业,P0306,2022-06-30,CNY,18.2500,19.2500,CNY,26983,CNY,2022-06-21,1.000,2,A,,2024-01-15,,4
1269,欧晶科技,2022-09-30,10,内蒙古欧晶科技股份有限公司,"Inner Mongolia OJing Quartz Co., Ltd.",5,工业,B07,有色金属矿采选业,C42,废弃资源综合利用业,2011-04-22,内蒙古自治区,150000,呼和浩特市,150100,私营企业,P0306,2022-09-30,CNY,14.6500,15.6500,CNY,34356,CNY,2022-09-21,1.000,2,A,,2024-01-15,,4
1270,铖昌科技,2022-06-06,10,浙江铖昌科技股份有限公司,"Zhejiang Chengchang Technology Co., Ltd.",5,工业,G,信息技术业,C39,计算机、通信和其他电子设备制造业,2010-11-23,浙江省,330000,杭州市,330100,私营企业,P0306,2022-06-06,CNY,20.6800,21.6800,CNY,27954,CNY,2022-05-24,1.000,2,A,,2024-01-15,,4
1278,一彬科技,2023-03-08,10,宁波一彬电子科技股份有限公司,"Ningbo Yibin Electronic Technology Corp.",5,工业,C75,交通运输设备制造业,C36,汽车制造业,2006-08-03,浙江省,330000,慈溪市,330282,私营企业,P0306,2023-03-08,CNY,16.0000,17.0000,CNY,30933,CNY,2023-02-21,1.000,2,A,,2024-01-15,,4
1282,三联锻造,2023-05-24,10,芜湖三联锻造股份有限公司,"Wuhu Sanlian Forging Co., Ltd.",5,工业,C75,交通运输设备制造业,C36,汽车制造业,2004-06-18,安徽省,340000,芜湖市,340200,私营企业,P0306,2023-05-24,CNY,26.9300,27.9300,CNY,28380,CNY,2023-05-11,1.000,2,A,,2024-01-15,,4
1283,豪鹏科技,2022-09-05,10,深圳市豪鹏科技股份有限公司,"Shenzhen Highpower Technology Co., Ltd.",5,工业,C76,电器机械及器材制造业,C38,电气机械及器材制造业,2002-10-08,广东省,440000,深圳市,440300,中外合资,P0303,2022-09-05,CNY,51.1900,52.1900,CNY,20000,CNY,2022-08-24,1.000,2,A,,2024-01-15,,4
1286,陕西能源,2023-04-10,10,陕西能源投资股份有限公司,"Shaanxi Energy Investment Co., Ltd.",5,工业,D01,电力、蒸汽、热水的生产和供应业,D44,电力、热力生产和供应业,2003-09-03,陕西省,610000,榆林市,610800,国营或国有控股,P0301,2023-04-10,CNY,8.6000,9.6000,CNY,750000,CNY,2023-03-29,1.000,2,A,,2024-01-15,,4
1287,中电港,2023-04-10,10,深圳中电港技术股份有限公司,"Shenzhen CECport Technology Co., Ltd.",6,商业,H,批发和零售贸易,F51,批发业,2014-09-28,广东省,440000,深圳市,440300,国营或国有控股,P0301,2023-04-10,CNY,10.8800,11.8800,CNY,189975,CNY,2023-03-28,1.000,2,A,,2024-01-15,,4
1288,运机集团,2021-11-01,10,四川省自贡运输机械集团股份有限公司,"Sichuan Zigong Conveying Machine Group Co., Ltd.",5,工业,C71,普通机械制造业,C34,通用设备制造业,2003-09-28,四川省,510000,自贡市,510300,私营企业,P0306,2021-11-01,CNY,13.5500,14.5500,CNY,40000,CNY,2021-10-20,1.000,2,A,,2024-01-15,,4
1289,龙源电力,2022-01-24,10,龙源电力集团股份有限公司,"China Longyuan Power Group Corporation Limited",5,工业,D01,电力、蒸汽、热水的生产和供应业,D44,电力、热力生产和供应业,1993-01-27,北京市,110000,北京市,110000,国营或国有控股,P0301,2022-01-24,CNY,10.3000,11.3000,CNY,345574,CNY,2022-01-21,1.000,2,A,,2024-01-15,00916,4
