Stkcd,Stknme,Listdt,Cuntrycd,Conme,Conme_en,Indcd,Indnme,Nindcd,Nindnme,Nnindcd,Nnindnme,Estbdt,PROVINCE,PROVINCECODE,CITY,CITYCODE,OWNERSHIPTYPE,OWNERSHIPTYPECODE,Favaldt,Curtrd,Ipoprm,Ipoprc,Ipocur,Nshripo,Parvcur,Ipodt,Parval,Sctcd,Statco,Crcd,Statdt,Commnt,Markettype
651,格力电器,1996-11-18,10,珠海格力电器股份有限公司,"Gree Electric Appliances Inc. of Zhuhai",5,工业,C76,电器机械及器材制造业,C38,电气机械及器材制造业,1989-12-13,广东省,440000,珠海市,440400,国营或国有控股,P0301,1996-11-18,CNY,1.5000,2.5000,CNY,47000,CNY,1992-03-01,1.000,2,A,,2024-01-15,,4
652,泰达股份,1996-11-28,10,天津泰达股份有限公司,"Tianjin TEDA Co., Ltd.",6,商业,H,批发和零售贸易,F51,批发业,1992-12-08,天津市,120000,天津市,120000,国营或国有控股,P0301,1996-11-28,CNY,1.8000,2.8000,CNY,23640,CNY,1992-07-20,1.000,2,A,,2024-01-15,,4
653,"ST 九州",1996-11-26,10,福建九州集团股份有限公司,"Fujian Jiuzhou Group Co., Ltd.",6,商业,H11,零售业,F52,零售业,1993-04-01,福建省,350000,厦门市,350200,国营或国有控股,P0301,1996-11-26,CNY,5.6000,6.6000,CNY,17008,CNY,1996-11-13,1.000,2,D,,2002-09-13,,4
655,金岭矿业,1996-11-28,10,山东金岭矿业股份有限公司,"Shandong Jinling Mining Co., Ltd.",5,工业,B05,黑色金属矿采选业,B08,黑色金属矿采选业,1989-04-04,山东省,370000,淄博市,370300,国营或国有控股,P0301,1996-11-28,CNY,0.0000,1.0000,CNY,15000,CNY,1993-10-01,1.000,2,A,,2024-01-15,,4
656,金科股份,1996-11-28,10,金科地产集团股份有限公司,"Jinke Property Group Co., Ltd.",3,房地产,J,房地产业,K70,房地产业,1987-03-20,重庆市,500000,重庆市,500000,私营企业,P0306,1996-11-28,CNY,0.0000,1.0000,CNY,370,CNY,1988-03-08,1.000,2,A,,2024-01-15,,4
657,中钨高新,1996-12-05,10,中钨高新材料股份有限公司,"China Tungsten and High-tech Materials Co., Ltd.",5,工业,C67,有色金属冶炼及压延加工业,C32,有色金属冶炼及压延加工业,1993-03-18,海南省,460000,海口市,460100,国营或国有控股,P0301,1996-12-05,CNY,3.8500,4.8500,CNY,21500,CNY,1996-11-25,1.000,2,A,,2024-01-15,,4
658,"ST 海洋",1996-12-18,10,厦门海洋实业(集团)股份有限公司,"Xiamen Marine Industry (Group) Co., Ltd.",4,综合,M,综合类,S90,综合,1993-07-02,福建省,350000,厦门市,350200,私营企业,P0306,1996-12-18,CNY,5.9900,6.9900,CNY,11000,CNY,1996-12-02,1.000,2,D,,2002-09-20,,4
659,珠海中富,1996-12-03,10,珠海中富实业股份有限公司,"Zhuhai Zhongfu Enterprise Co., Ltd.",5,工业,C4,石油、化学、塑胶、塑料,C29,橡胶和塑料制品业,1988-03-01,广东省,440000,珠海市,440400,中外合资,P0303,1996-12-03,CNY,0.0000,1.0000,CNY,31375,CNY,1992-05-03,1.000,2,A,,2024-01-15,,4
660,"*ST 南华",1996-12-09,10,广州汇集实业股份有限公司,"Guangzhou Huiji Industrial Co., Ltd.",4,综合,M,综合类,S90,综合,1996-12-01,广东省,440000,广州市,440100,私营企业,P0306,1996-12-09,CNY,7.3800,8.3800,CNY,12500,CNY,1996-11-20,1.000,2,D,,2004-09-13,,4
661,长春高新,1996-12-18,10,长春高新技术产业(集团)股份有限公司,"Changchun High & New Technology Industries (Group) Inc.",5,工业,C81,医药制造业,C27,医药制造业,1993-06-10,吉林省,220000,长春市,220100,国营或国有控股,P0301,1996-12-18,CNY,7.8000,8.8000,CNY,13640,CNY,1996-12-03,1.000,2,A,,2024-01-15,,4
662,天夏退,1996-12-16,10,天夏智慧城市科技股份有限公司,"Teamax Smart City Technology Co., Ltd.",2,公用事业,G87,计算机应用服务业,I65,软件和信息技术服务业,1993-02-04,广西壮族自治区,450000,梧州市,450400,私营企业,P0306,1996-12-16,CNY,3.6800,4.6800,CNY,14285,CNY,1996-12-03,1.000,2,D,,2021-04-12,,4
663,永安林业,1996-12-06,10,福建省永安林业(集团)股份有限公司,"Fujian Yongan Forestry (Group) Joint-Stock Co., Ltd.",5,工业,C25,家具制造业,C21,家具制造业,1994-01-06,福建省,350000,永安市,350481,国营或国有控股,P0301,1996-12-06,CNY,4.0000,5.0000,CNY,19500,CNY,1996-11-24,1.000,2,A,,2024-01-15,,4
665,湖北广电,1996-12-10,10,湖北省广播电视信息网络股份有限公司,"Hubei Radio & Television Information Network Co., Ltd.",2,公用事业,L10,广播电影电视业,R86,广播、电视、电影和影视录音制作业,1988-11-01,湖北省,420000,武汉市,420100,国营或国有控股,P0301,1996-12-10,CNY,0.0000,1.0000,CNY,19800,CNY,1992-03-01,1.000,2,A,,2024-01-15,,4
666,经纬纺机,1996-12-10,10,经纬纺织机械股份有限公司,"Jingwei Textile Machinery Co., Ltd.",1,金融,I21,证券、期货业,J67,资本市场服务,1995-08-15,北京市,110000,北京市,110000,国营或国有控股,P0301,1996-12-10,CNY,3.5000,4.5000,CNY,23000,CNY,1996-11-20,1.000,2,D,,2023-10-26,,4
667,"ST 美置",1996-12-05,10,美好置业集团股份有限公司,"Myhome Real Estate Development Group Co., Ltd.",3,房地产,J,房地产业,K70,房地产业,1989-03-11,云南省,530000,昆明市,530100,私营企业,P0306,1996-12-05,CNY,0.0000,1.0000,CNY,25060,CNY,1990-12-01,1.000,2,D,,2023-07-14,,4
668,荣丰控股,1996-12-10,10,荣丰控股集团股份有限公司,"Rongfeng Holding Group Co., Ltd.",3,房地产,J,房地产业,K70,房地产业,1988-09-02,山东省,370000,青岛市,370200,私营企业,P0306,1996-12-10,CNY,0.0000,1.0000,CNY,14270,CNY,1990-03-01,1.000,2,A,,2024-01-15,,4
669,"ST 金鸿",1996-12-10,10,金鸿控股集团股份有限公司,"Jinhong Holding Group Co., Ltd.",5,工业,D03,煤气生产和供应业,D45,燃气生产和供应业,1992-12-25,吉林省,220000,吉林市,220200,中外合资,P0303,1996-12-10,CNY,3.6000,4.6000,CNY,13670,CNY,1996-11-24,1.000,2,A,,2024-01-15,,4
670,盈方微,1996-12-17,10,盈方微电子股份有限公司,"Infotmic Co., Ltd.",5,工业,G,信息技术业,C39,计算机、通信和其他电子设备制造业,1989-05-01,湖北省,420000,荆州市,421000,私营企业,P0306,1996-12-17,CNY,0.0000,1.0000,CNY,30090,CNY,1992-09-01,1.000,2,A,,2024-01-15,,4
671,"ST 阳光城",1996-12-18,10,阳光城集团股份有限公司,"Yango Group Co., Ltd.",3,房地产,J,房地产业,K70,房地产业,1991-08-02,福建省,350000,福州市,350100,私营企业,P0306,1996-12-18,CNY,0.0000,1.0000,CNY,8000,CNY,1991-03-01,1.000,2,D,,2023-08-16,,4
672,上峰水泥,1996-12-18,10,甘肃上峰水泥股份有限公司,"Gansu Shangfeng Cement Co., Ltd.",5,工业,C61,非金属矿物制品业,C30,非金属矿物制品业,1992-09-30,甘肃省,620000,白银市,620400,私营企业,P0306,1996-12-18,CNY,0.0000,1.0000,CNY,13540,CNY,1992-05-21,1.000,2,A,,2024-01-15,,4
673,当代退,1997-01-24,10,当代东方投资股份有限公司,"Lead Eastern Investment Co., Ltd.",2,公用事业,L15,艺术业,R87,文化艺术业,1997-01-17,山西省,140000,大同市,140200,私营企业,P0306,1997-01-24,CNY,6.1500,7.1500,CNY,15000,CNY,1996-12-20,1.000,2,D,,2022-07-04,,4
675,"ST 银山",1996-12-26,10,四川银山化工(集团)股份有限公司,"Sichuan Yinshan Chemical Industry (Group) Co., Ltd.",5,工业,C43,化学原料及化学制品制造业,C26,化学原料及化学制品制造业,1988-12-28,四川省,510000,内江市,511000,国营或国有控股,P0301,1996-12-26,CNY,0.0000,1.0000,CNY,15000,CNY,1992-09-01,1.000,2,D,,2002-08-20,,4
676,智度股份,1996-12-24,10,智度科技股份有限公司,"Genimous Technology Co., Ltd.",2,公用事业,G87,计算机应用服务业,I64,互联网和相关服务,1996-12-16,广东省,440000,广州市,440100,私营企业,P0306,1996-12-24,CNY,4.2000,5.2000,CNY,12500,CNY,1996-12-03,1.000,2,A,,2024-01-15,,4
677,恒天海龙,1996-12-26,10,恒天海龙股份有限公司,"CHTC Helon Co., Ltd.",5,工业,C47,化学纤维制造业,C28,化学纤维制造业,1988-12-28,山东省,370000,潍坊市,370700,国营或国有控股,P0301,1996-12-26,CNY,0.0000,1.0000,CNY,142,CNY,1990-07-05,1.000,2,A,,2024-01-15,,4
678,襄阳轴承,1997-01-06,10,襄阳汽车轴承股份有限公司,"Xiangyang Automobile Bearing Co., Ltd.",5,工业,C71,普通机械制造业,C34,通用设备制造业,1993-05-06,湖北省,420000,襄阳市,420600,国营或国有控股,P0301,1997-01-06,CNY,10.1800,11.1800,CNY,10382,CNY,1996-12-24,1.000,2,A,,2024-01-15,,4
679,大连友谊,1997-01-24,10,大连友谊(集团)股份有限公司,"Dalian Friendship (Group) Co., Ltd.",6,商业,H11,零售业,F52,零售业,1993-05-08,辽宁省,210000,大连市,210200,私营企业,P0306,1997-01-24,CNY,8.8000,9.8000,CNY,35000,CNY,1996-12-26,1.000,2,A,,2024-01-15,,4
680,山推股份,1997-01-22,10,山推工程机械股份有限公司,"Shantui Construction Machinery Co., Ltd.",5,工业,C73,专用设备制造业,C35,专用设备制造业,1993-10-08,山东省,370000,济宁市,370800,国营或国有控股,P0301,1997-01-22,CNY,3.2800,4.2800,CNY,88600,CNY,1996-12-27,1.000,2,A,,2024-01-15,,4
681,视觉中国,1997-01-21,10,视觉(中国)文化发展股份有限公司,"Visual China Group Co., Ltd.",2,公用事业,L15,艺术业,R87,文化艺术业,1993-12-28,江苏省,320000,常州市,320400,私营企业,P0306,1997-01-21,CNY,4.3000,5.3000,CNY,12500,CNY,1996-12-31,1.000,2,A,,2024-01-15,,4
682,东方电子,1997-01-21,10,东方电子股份有限公司,"Dongfang Electronics Co., Ltd.",2,公用事业,G87,计算机应用服务业,I65,软件和信息技术服务业,1994-02-09,山东省,370000,烟台市,370600,国营或国有控股,P0301,1997-01-21,CNY,6.8800,7.8800,CNY,10300,CNY,1996-12-17,1.000,2,A,,2024-01-15,,4
683,远兴能源,1997-01-31,10,内蒙古远兴能源股份有限公司,"Inner Mongolia Yuanxing Energy Co., Ltd.",5,工业,C43,化学原料及化学制品制造业,C26,化学原料及化学制品制造业,1997-01-23,内蒙古自治区,150000,鄂尔多斯市,150600,私营企业,P0306,1997-01-31,CNY,4.1100,5.1100,CNY,65000,CNY,1997-01-13,1.000,2,A,,2024-01-15,,4
685,中山公用,1997-01-23,10,中山公用事业集团股份有限公司,"Zhongshan Public Utilities Group Co., Ltd.",2,公用事业,D05,自来水的生产和供应业,D46,水的生产和供应业,1992-12-26,广东省,440000,中山市,442000,国营或国有控股,P0301,1997-01-23,CNY,5.7400,6.7400,CNY,16000,CNY,1997-01-14,1.000,2,A,,2024-01-15,,4
686,东北证券,1997-02-27,10,东北证券股份有限公司,"Northeast Securities Co., Ltd.",1,金融,I21,证券、期货业,J67,资本市场服务,1993-08-20,吉林省,220000,长春市,220100,国营或国有控股,P0301,1997-02-27,CNY,5.3800,6.3800,CNY,11800,CNY,1996-12-27,1.000,2,A,,2024-01-15,,4
687,华讯退,1997-02-21,10,华讯方舟股份有限公司,"Huaxun Fangzhou Co., Ltd.",5,工业,G,信息技术业,C39,计算机、通信和其他电子设备制造业,1997-02-01,广东省,440000,深圳市,440300,国营或国有控股,P0301,1997-02-21,CNY,5.3000,6.3000,CNY,75000,CNY,1997-01-15,1.000,2,D,,2022-06-17,,4
688,国城矿业,1997-01-20,10,国城矿业股份有限公司,"Guocheng Mining Co., Ltd.",5,工业,B07,有色金属矿采选业,B09,有色金属矿采选业,1989-04-20,四川省,510000,马尔康市,513201,私营企业,P0306,1997-01-20,CNY,3.9400,4.9400,CNY,20000,CNY,1996-12-18,1.000,2,A,,2024-01-15,,4
689,"ST 宏业",1996-12-31,10,汕头宏业(集团)股份有限公司,"Shantou Hongye (Group) Co., Ltd.",5,工业,C67,有色金属冶炼及压延加工业,C32,有色金属冶炼及压延加工业,1992-11-18,广东省,440000,汕头市,440500,私营企业,P0306,1996-12-31,CNY,5.9800,6.9800,CNY,13500,CNY,1996-12-24,1.000,2,D,,2002-09-05,,4
690,宝新能源,1997-01-28,10,广东宝丽华新能源股份有限公司,"Guangdong Baolihua New Energy Stock Co., Ltd.",5,工业,D01,电力、蒸汽、热水的生产和供应业,D44,电力、热力生产和供应业,1997-01-20,广东省,440000,梅州市,441400,私营企业,P0306,1997-01-28,CNY,6.0800,7.0800,CNY,12500,CNY,1997-01-07,1.000,2,A,,2024-01-15,,4
691,亚太实业,1997-02-28,10,甘肃亚太实业发展股份有限公司,"Gansu Yatai Industrial Development Co., Ltd.",5,工业,C43,化学原料及化学制品制造业,C26,化学原料及化学制品制造业,1992-11-21,甘肃省,620000,兰州市,620100,国营或国有控股,P0301,1997-02-28,CNY,5.1500,6.1500,CNY,31000,CNY,1997-01-24,1.000,2,A,,2024-01-15,,4
692,"*ST 惠天",1997-02-27,10,沈阳惠天热电股份有限公司,"Shenyang Huitian Thermal Power Co., Ltd.",5,工业,D01,电力、蒸汽、热水的生产和供应业,D44,电力、热力生产和供应业,1993-12-28,辽宁省,210000,沈阳市,210100,国营或国有控股,P0301,1997-02-27,CNY,11.1300,12.1300,CNY,11000,CNY,1997-01-27,1.000,2,A,,2024-01-15,,4
693,华泽退,1997-02-26,10,成都华泽钴镍材料股份有限公司,"Chengdu Huaze Cobalt & Nickel Material Co., Ltd.",5,工业,B07,有色金属矿采选业,B09,有色金属矿采选业,1993-12-31,四川省,510000,成都市,510100,私营企业,P0306,1997-02-26,CNY,0.2500,1.2500,CNY,45060,CNY,1993-01-01,1.000,2,D,,2019-07-09,,4
695,滨海能源,1997-02-18,10,天津滨海能源发展股份有限公司,"Tianjin Binhai Energy & Development Co., Ltd.",5,工业,C35,印刷业,C23,印刷和记录媒介复制业,1992-10-20,天津市,120000,天津市,120000,国营或国有控股,P0301,1997-02-18,CNY,1.2000,2.2000,CNY,50000,CNY,1992-07-20,1.000,2,A,,2024-01-15,,4
697,"*ST 炼石",1997-03-25,10,炼石航空科技股份有限公司,"Ligeance Aerospace Technology Co., Ltd.",5,工业,C75,交通运输设备制造业,C37,铁路、船舶、航空航天和其它运输设备制造业,1993-06-08,陕西省,610000,咸阳市,610400,私营企业,P0306,1997-03-25,CNY,4.9500,5.9500,CNY,11293,CNY,1997-02-25,1.000,2,A,,2024-01-15,,4
698,沈阳化工,1997-02-20,10,沈阳化工股份有限公司,"Shenyang Chemical Co., Ltd.",5,工业,C41,石油加工及炼焦业,C25,石油加工、炼焦及核燃料加工业,1993-01-01,辽宁省,210000,沈阳市,210100,国营或国有控股,P0301,1997-02-20,CNY,5.4000,6.4000,CNY,80000,CNY,1997-01-21,1.000,2,A,,2024-01-15,,4
699,"S*ST 佳纸",1997-03-10,10,佳木斯金地造纸股份有限公司,"Jiamusijindi Paper Co., Ltd.",5,工业,C31,造纸及纸制品业,C22,造纸及纸制品业,1994-01-28,黑龙江省,230000,佳木斯市,230800,私营企业,P0306,1997-03-10,CNY,3.7000,4.7000,CNY,50000,CNY,1997-02-25,1.000,2,D,,2007-04-04,,4
700,模塑科技,1997-02-28,10,江南模塑科技股份有限公司,"Jiangnan Mould & Plastic Technology Co., Ltd.",5,工业,C75,交通运输设备制造业,C36,汽车制造业,1988-06-27,江苏省,320000,江阴市,320281,私营企业,P0306,1997-02-28,CNY,0.0000,100.0000,CNY,79,CNY,1991-08-01,100.000,2,A,,2024-01-15,,4
701,厦门信达,1997-02-26,10,厦门信达股份有限公司,"Xiamen Xindeco Ltd.",6,商业,H,批发和零售贸易,F51,批发业,1992-10-28,福建省,350000,厦门市,350200,国营或国有控股,P0301,1997-02-26,CNY,3.0700,4.0700,CNY,65000,CNY,1997-01-19,1.000,2,A,,2024-01-15,,4
702,正虹科技,1997-03-18,10,湖南正虹科技发展股份有限公司,"Hunan Zhenghong Science and Technology Develop Co., Ltd.",5,工业,C01,食品加工业,C13,农副食品加工业,1997-03-12,湖南省,430000,岳阳市,430600,国营或国有控股,P0301,1997-03-18,CNY,6.0600,7.0600,CNY,50000,CNY,1997-02-25,1.000,2,A,,2024-01-15,,4
703,恒逸石化,1997-03-28,10,恒逸石化股份有限公司,"Hengyi Petrochemical Co., Ltd.",5,工业,C47,化学纤维制造业,C28,化学纤维制造业,1990-05-08,广西壮族自治区,450000,钦州市,450700,国营或国有控股,P0301,1997-03-28,CNY,0.0000,1.0000,CNY,36000,CNY,1992-03-01,1.000,2,A,,2024-01-15,,4
705,浙江震元,1997-04-10,10,浙江震元股份有限公司,"Zhejiang Zhenyuan Share Co., Ltd.",6,商业,H,批发和零售贸易,F51,批发业,1993-06-14,浙江省,330000,绍兴市,330600,国营或国有控股,P0301,1997-04-10,CNY,3.4500,4.4500,CNY,25000,CNY,1997-03-20,1.000,2,A,,2024-01-15,,4
707,双环科技,1997-04-15,10,湖北双环科技股份有限公司,"Hubei Shuanghuan Science and Technology Stock Co., Ltd.",5,工业,C43,化学原料及化学制品制造业,C26,化学原料及化学制品制造业,1993-03-28,湖北省,420000,应城市,420981,国营或国有控股,P0301,1997-04-15,CNY,6.6000,7.6000,CNY,60000,CNY,1997-04-03,1.000,2,A,,2024-01-15,,4
708,中信特钢,1997-03-26,10,中信泰富特钢集团股份有限公司,"CITIC Pacific Special Steel Group Co., Ltd",5,工业,C65,黑色金属冶炼及压延加工业,C31,黑色金属冶炼及压延加工业,1993-05-18,湖北省,420000,黄石市,420200,中外合资,P0303,1997-03-26,CNY,7.7000,8.7000,CNY,70000,CNY,1997-03-14,1.000,2,A,,2024-01-15,,4
709,河钢股份,1997-04-16,10,河钢股份有限公司,"HBIS Company Limited",5,工业,C65,黑色金属冶炼及压延加工业,C31,黑色金属冶炼及压延加工业,1994-06-29,河北省,130000,石家庄市,130100,国营或国有控股,P0301,1997-04-16,CNY,8.2200,9.2200,CNY,120000,CNY,1997-03-27,1.000,2,A,,2024-01-15,,4
710,贝瑞基因,1997-04-22,10,成都市贝瑞和康基因技术股份有限公司,"Berry Genomics Co., Ltd",2,公用事业,K20,专业、科研服务业,M74,专业技术服务业,1997-04-14,四川省,510000,成都市,510100,国营或国有控股,P0301,1997-04-22,CNY,4.1000,5.1000,CNY,17500,CNY,1997-04-02,1.000,2,A,,2024-01-15,,4
711,"*ST 京蓝",1997-04-11,10,京蓝科技股份有限公司,"Kingland Technology Co., Ltd.",3,房地产,E01,土木工程建筑业,E48,土木工程建筑业,1993-03-31,黑龙江省,230000,哈尔滨市,230100,私营企业,P0306,1997-04-11,CNY,3.0900,4.0900,CNY,14640,CNY,1997-03-28,1.000,2,A,,2024-01-15,,4
712,锦龙股份,1997-04-15,10,广东锦龙发展股份有限公司,"Guangdong Golden Dragon Development Inc.",1,金融,I21,证券、期货业,J67,资本市场服务,1997-04-09,广东省,440000,东莞市,441900,私营企业,P0306,1997-04-15,CNY,6.2800,7.2800,CNY,16707,CNY,1997-03-25,1.000,2,A,,2024-01-15,,4
713,丰乐种业,1997-04-22,10,合肥丰乐种业股份有限公司,"Hefei Fengle Seed Co., Ltd.",4,综合,A09,农、林、牧、渔服务业,A05,农、林、牧、渔服务业,1984-06-16,安徽省,340000,合肥市,340100,国营或国有控股,P0301,1997-04-22,CNY,5.7500,6.7500,CNY,45000,CNY,1997-04-04,1.000,2,A,,2024-01-15,,4
715,中兴商业,1997-05-08,10,中兴-沈阳商业大厦(集团)股份有限公司,"Zhongxing Shenyang Commercial Building (Group) Co., Ltd.",6,商业,H11,零售业,F52,零售业,1997-04-25,辽宁省,210000,沈阳市,210100,国营或国有控股,P0301,1997-05-08,CNY,6.5000,7.5000,CNY,30000,CNY,1997-04-15,1.000,2,A,,2024-01-15,,4
716,黑芝麻,1997-04-18,10,南方黑芝麻集团股份有限公司,"Nanfang Black Sesame Group Co., Ltd.",5,工业,C03,食品制造业,C14,食品制造业,1993-05-31,广西壮族自治区,450000,玉林市,450900,私营企业,P0306,1997-04-18,CNY,2.7500,3.7500,CNY,30000,CNY,1997-03-28,1.000,2,A,,2024-01-15,,4
717,中南股份,1997-05-08,10,广东中南钢铁股份有限公司,"Guangdong Zhongnan Iron & Steel Co., Ltd.",5,工业,C65,黑色金属冶炼及压延加工业,C31,黑色金属冶炼及压延加工业,1989-09-11,广东省,440000,韶关市,440200,国营或国有控股,P0301,1997-05-08,CNY,6.7600,7.7600,CNY,80000,CNY,1997-04-21,1.000,2,A,,2024-01-15,,4
718,苏宁环球,1997-04-08,10,苏宁环球股份有限公司,"Suning Universal Co., Ltd.",3,房地产,J,房地产业,K70,房地产业,1993-04-01,吉林省,220000,吉林市,220200,私营企业,P0306,1997-04-08,CNY,5.4500,6.4500,CNY,60000,CNY,1997-03-28,1.000,2,A,,2024-01-15,,4
719,中原传媒,1997-03-31,10,中原大地传媒股份有限公司,"Central China Land Media Co., Ltd.",2,公用事业,L01,出版业,R85,新闻和出版业,1989-02-23,河南省,410000,焦作市,410800,国营或国有控股,P0301,1997-03-31,CNY,0.0000,1.0000,CNY,14775,CNY,1990-02-01,1.000,2,A,,2024-01-15,,4
720,新能泰山,1997-05-09,10,山东新能泰山发电股份有限公司,"Shandong Xinneng Taishan Power Generation Co., Ltd.",3,房地产,J,房地产业,K70,房地产业,1994-03-28,山东省,370000,泰安市,370900,国营或国有控股,P0301,1997-05-09,CNY,5.8600,6.8600,CNY,40000,CNY,1997-04-22,1.000,2,A,,2024-01-15,,4
721,西安饮食,1997-04-30,10,西安饮食股份有限公司,"Xi'an Catering Co., Ltd.",6,商业,K30,餐饮业,H62,餐饮业,1994-05-18,陕西省,610000,西安市,610100,国营或国有控股,P0301,1997-04-30,CNY,2.1500,3.1500,CNY,40000,CNY,1997-04-09,1.000,2,A,,2024-01-15,,4
722,湖南发展,1997-05-22,10,湖南发展集团股份有限公司,"Hunan Fazhan Industrial Co., Ltd.",5,工业,D01,电力、蒸汽、热水的生产和供应业,D44,电力、热力生产和供应业,1993-08-12,湖南省,430000,长沙市,430100,国营或国有控股,P0301,1997-05-22,CNY,4.0900,5.0900,CNY,25000,CNY,1997-05-06,1.000,2,A,,2024-01-15,,4
723,美锦能源,1997-05-15,10,山西美锦能源股份有限公司,"Shanxi Meijin Energy Co., Ltd.",5,工业,C41,石油加工及炼焦业,C25,石油加工、炼焦及核燃料加工业,1992-10-22,山西省,140000,太原市,140100,私营企业,P0306,1997-05-15,CNY,4.8000,5.8000,CNY,30000,CNY,1997-04-23,1.000,2,A,,2024-01-15,,4
725,京东方A,2001-01-12,10,京东方科技集团股份有限公司,"BOE Technology Group Co., Ltd.",5,工业,G,信息技术业,C39,计算机、通信和其他电子设备制造业,1993-04-09,北京市,110000,北京市,110000,国营或国有控股,P0301,2001-01-12,CNY,15.8000,16.8000,CNY,60000,CNY,2000-12-19,1.000,2,A,200725,2024-01-15,,4
726,鲁泰A,2000-12-25,10,鲁泰纺织股份有限公司,"Luthai Textile Co., Ltd.",5,工业,C11,纺织业,C17,纺织业,1993-10-16,山东省,370000,淄博市,370300,私营企业,P0306,2000-12-25,CNY,16.8000,17.8000,CNY,50000,CNY,2000-12-06,1.000,2,A,200726,2024-01-15,,4
727,冠捷科技,1997-05-20,10,冠捷电子科技股份有限公司,"TPV Technology Co., Ltd.",5,工业,G,信息技术业,C39,计算机、通信和其他电子设备制造业,1997-05-14,江苏省,320000,南京市,320100,国营或国有控股,P0301,1997-05-20,CNY,5.1600,6.1600,CNY,40000,CNY,1997-05-07,1.000,2,A,,2024-01-15,,4
728,国元证券,1997-06-16,10,国元证券股份有限公司,"Guoyuan Securities Co., Ltd.",1,金融,I21,证券、期货业,J67,资本市场服务,1997-06-06,安徽省,340000,合肥市,340100,国营或国有控股,P0301,1997-06-16,CNY,6.2000,7.2000,CNY,80000,CNY,1997-05-22,1.000,2,A,,2024-01-15,,4
729,燕京啤酒,1997-07-16,10,北京燕京啤酒股份有限公司,"Beijing Yanjing Beer Co., Ltd.",5,工业,C05,饮料制造业,C15,酒、饮料和精制茶制造业,1997-07-08,北京市,110000,北京市,110000,国营或国有控股,P0301,1997-07-16,CNY,6.3400,7.3400,CNY,80000,CNY,1997-06-25,1.000,2,A,,2024-01-15,,4
730,"*ST 环保",1997-05-22,10,沈阳特种环保设备制造股份有限公司,"Shenyang Special Environmental Protection Equipment Manufacturing Co., Ltd.",4,综合,E05,装修装饰业,E50,建筑装饰和其他建筑业,1993-05-18,辽宁省,210000,沈阳市,210100,其他,P0399,1997-05-22,CNY,5.5300,6.5300,CNY,33000,CNY,1997-05-06,1.000,2,D,,2004-09-24,,4
731,四川美丰,1997-06-17,10,四川美丰化工股份有限公司,"Sichuan Meifeng Chemical Industry Co., Ltd.",5,工业,C43,化学原料及化学制品制造业,C26,化学原料及化学制品制造业,1994-03-03,四川省,510000,遂宁市,510900,国营或国有控股,P0301,1997-06-17,CNY,7.8500,8.8500,CNY,23000,CNY,1997-05-30,1.000,2,A,,2024-01-15,,4
732,"ST 泰禾",1997-07-04,10,泰禾集团股份有限公司,"Thaihot Group Co., Ltd.",3,房地产,J,房地产业,K70,房地产业,1992-12-29,福建省,350000,三明市,350400,私营企业,P0306,1997-07-04,CNY,3.3000,4.3000,CNY,40000,CNY,1997-06-18,1.000,2,D,,2023-08-04,,4
733,振华科技,1997-07-03,10,中国振华(集团)科技股份有限公司,"China Zhenhua (Group) Science & Technology Co., Ltd.",5,工业,G,信息技术业,C39,计算机、通信和其他电子设备制造业,1997-06-26,贵州省,520000,贵阳市,520100,国营或国有控股,P0301,1997-07-03,CNY,6.8100,7.8100,CNY,70000,CNY,1997-06-17,1.000,2,A,,2024-01-15,,4
735,罗牛山,1997-06-11,10,罗牛山股份有限公司,"Luoniushan Co., Ltd.",4,综合,A05,畜牧业,A03,畜牧业,1993-10-15,海南省,460000,海口市,460100,私营企业,P0306,1997-06-11,CNY,3.3500,4.3500,CNY,45000,CNY,1997-05-25,1.000,2,A,,2024-01-15,,4
736,中交地产,1997-04-25,10,中交地产股份有限公司,"CCCG Real Estate Corporation Limited",3,房地产,J,房地产业,K70,房地产业,1993-02-03,重庆市,500000,重庆市,500000,国营或国有控股,P0301,1997-04-25,CNY,2.3000,3.3000,CNY,10000,CNY,1997-04-10,1.000,2,A,,2024-01-15,,4
737,北方铜业,1997-04-28,10,北方铜业股份有限公司,"NORTH COPPER (SHANXI) CO.,LTD.",5,工业,C43,化学原料及化学制品制造业,C26,化学原料及化学制品制造业,1996-04-02,山西省,140000,运城市,140800,国营或国有控股,P0301,1997-04-28,CNY,5.4700,6.4700,CNY,62000,CNY,1997-04-08,1.000,2,A,,2024-01-15,,4
738,航发控制,1997-06-26,10,中国航发动力控制股份有限公司,"AECC Aero-Engine Control Co., Ltd.",5,工业,C75,交通运输设备制造业,C37,铁路、船舶、航空航天和其它运输设备制造业,1997-06-20,江苏省,320000,无锡市,320200,国营或国有控股,P0301,1997-06-26,CNY,6.2000,7.2000,CNY,85000,CNY,1997-06-12,1.000,2,A,,2024-01-15,,4
739,普洛药业,1997-05-09,10,普洛药业股份有限公司,"Apeloa Pharmaceutical Co., Ltd.",5,工业,C81,医药制造业,C27,医药制造业,1997-05-06,浙江省,330000,东阳市,330783,私营企业,P0306,1997-05-09,CNY,4.7000,5.7000,CNY,30000,CNY,1997-04-22,1.000,2,A,,2024-01-15,,4
748,长城信息,1997-07-04,10,长城信息产业股份有限公司,"Greatwall Information Industry Co., Ltd.",5,工业,G,信息技术业,C39,计算机、通信和其他电子设备制造业,1997-06-27,湖南省,430000,长沙市,430100,私营企业,P0306,1997-07-04,CNY,5.5200,6.5200,CNY,45000,CNY,1997-06-17,1.000,2,D,,2017-01-18,,4
